chapter,verse,text,prep,aqidah,akhlak,syariah,ilmu,kisah,dunia,ghaib,akhirat
1,1,Dengan menyebut nama Allah Yang Maha Pemurah lagi Maha Penyayang.,sebut nama allah maha murah maha sayang,1,0,0,0,0,0,0,0
1,2,"Segala puji bagi Allah, Tuhan semesta alam.",puji allah tuhan semesta alam,1,1,0,0,0,0,0,0
1,3,Maha Pemurah lagi Maha Penyayang.,maha murah maha sayang,1,0,0,0,0,0,0,0
1,4,Yang menguasai di Hari Pembalasan.,kuasa hari balas,1,0,0,0,0,0,0,0
1,5,"Hanya Engkaulah yang kami sembah, dan hanya kepada Engkaulah kami meminta pertolongan.",engkau sembah engkau tolong,1,0,1,0,0,0,0,0
1,6,"Tunjukilah kami jalan yang lurus,",tunjuk jalan lurus,1,1,0,0,0,0,0,0
1,7,(yaitu) Jalan orang-orang yang telah Engkau beri nikmat kepada mereka; bukan (jalan) mereka yang dimurkai dan bukan (pula jalan) mereka yang sesat.,jalan orangorang engkau nikmat jalan murka jalan sesat,1,1,0,0,0,0,0,0
2,1,Alif laam miim.,alif laam miim,1,0,0,0,0,0,0,0
